{
  "state_id": "st_synthetic_001",
  "goal_id": "g_synthetic_multiphase",
  "version": 0,
  "objective": "Synthetic multi-phase Goal for MEA lift-harness readiness",
  "non_negotiable_constraints": ["network=none", "no_external_effects"],
  "acceptance_criteria": [
    {
      "id": "phase1_file",
      "kind": "command",
      "run": "test -f /workspace/phase1.done",
      "expect_exit": 0,
      "weight": 1.0,
      "timeout_s": 300,
      "isolation": "fresh_context",
      "source": "caller",
      "preregistered": true
    },
    {
      "id": "phase2_file",
      "kind": "command",
      "run": "test -f /workspace/phase2.done",
      "expect_exit": 0,
      "weight": 1.0,
      "timeout_s": 300,
      "isolation": "fresh_context",
      "source": "caller",
      "preregistered": true
    }
  ],
  "criteria_snapshot_hash": "synthetic-criteria-v0",
  "scope": {
    "files": ["/workspace"],
    "commands": [],
    "network": "none",
    "permissions": [],
    "notes": null
  },
  "isolation_policy_ref": "container_default",
  "accepted_commit": null,
  "verified_decisions": [],
  "failed_approaches": [],
  "current_blockers": [],
  "current_phase": "intake",
  "assigned_route": null,
  "evidence_refs": [],
  "budget_residual": {
    "max_attempts": 8,
    "max_tool_calls": 200,
    "max_tokens": null,
    "max_wall_clock_s": 900,
    "max_cost_usd": 2.0,
    "max_branches": 3,
    "max_parallel_steps": 8,
    "claim_timeout_s": 60,
    "max_versions_written": 2
  },
  "last_auditor_report_id": null,
  "provenance": {
    "source": "synthetic",
    "source_ref": "tests/fixtures/mea/synthetic_multiphase_state_v0.json",
    "captured_at": null,
    "run_id": null,
    "notes": ["Phase 1 exit criterion fixture; not a live run"]
  },
  "updated_at": "2026-08-23T00:00:00Z",
  "rounds_consumed": 0,
  "max_rounds": 6
}
